{
  "title": "小学数学练习（示例配置）",
  "curriculum_system": "中国大陆普通教育（教师确认）",
  "region": "用户自报地区",
  "stage": "primary",
  "stage_year": 4,
  "grade_label": "四年级",
  "subject_code": "math",
  "subject_label": "数学",
  "textbook": null,
  "module": null,
  "taught_scope": {
    "topics": [
      "整数四则运算"
    ],
    "excluded_topics": [],
    "permitted_methods": [
      "仅使用教师确认的已教方法"
    ],
    "scope_confirmed": true
  },
  "purpose": "review",
  "usage_context": "personal_learning",
  "delivery_mode": "paper",
  "total_score_x100": 10000,
  "duration_minutes": 60,
  "sections": [
    {
      "id": "p1",
      "title": "计算题",
      "question_type": "solution",
      "count": 20,
      "score_each_x100": 500,
      "topics": [
        "整数四则运算"
      ]
    }
  ],
  "difficulty_distribution": {
    "basic": 60,
    "medium": 30,
    "advanced": 10
  },
  "output_preferences": {
    "paper_size": "A4",
    "font_size_pt": 12,
    "include_answer_space": true
  },
  "provided_materials": []
}
