{
  "title": "七年级数学复习练习（示例配置）",
  "curriculum_system": "中国大陆普通教育（教师确认）",
  "region": "用户自报地区",
  "stage": "junior",
  "stage_year": 1,
  "grade_label": "七年级",
  "subject_code": "math",
  "subject_label": "数学",
  "textbook": null,
  "module": "一元一次方程",
  "taught_scope": {
    "topics": [
      "一元一次方程的求解",
      "方程的应用"
    ],
    "excluded_topics": [
      "二元一次方程组"
    ],
    "permitted_methods": [
      "移项与合并同类项"
    ],
    "scope_confirmed": true
  },
  "purpose": "review",
  "usage_context": "personal_learning",
  "delivery_mode": "paper",
  "total_score_x100": 10000,
  "duration_minutes": 60,
  "sections": [
    {
      "id": "s1",
      "title": "选择题",
      "question_type": "single_choice",
      "count": 10,
      "score_each_x100": 300,
      "topics": [
        "一元一次方程的求解"
      ]
    },
    {
      "id": "s2",
      "title": "解答题",
      "question_type": "solution",
      "count": 7,
      "score_each_x100": 1000,
      "topics": [
        "方程的应用"
      ]
    }
  ],
  "difficulty_distribution": {
    "basic": 60,
    "medium": 30,
    "advanced": 10
  },
  "output_preferences": {
    "paper_size": "A4",
    "font_size_pt": 12,
    "include_answer_space": true
  },
  "provided_materials": []
}
